# Flydigi Flydigi APEX 4
# 0x05, 0x01,                    // Usage Page (Generic Desktop)        0
# 0x09, 0x02,                    // Usage (Mouse)                       2
# 0xa1, 0x01,                    // Collection (Application)            4
# 0x85, 0x02,                    //  Report ID (2)                      6
# 0x09, 0x01,                    //  Usage (Pointer)                    8
# 0xa1, 0x00,                    //  Collection (Physical)              10
# 0x05, 0x09,                    //   Usage Page (Button)               12
# 0x19, 0x01,                    //   Usage Minimum (1)                 14
# 0x29, 0x05,                    //   Usage Maximum (5)                 16
# 0x15, 0x00,                    //   Logical Minimum (0)               18
# 0x25, 0x01,                    //   Logical Maximum (1)               20
# 0x95, 0x05,                    //   Report Count (5)                  22
# 0x75, 0x01,                    //   Report Size (1)                   24
# 0x81, 0x02,                    //   Input (Data,Var,Abs)              26
# 0x95, 0x01,                    //   Report Count (1)                  28
# 0x75, 0x03,                    //   Report Size (3)                   30
# 0x81, 0x01,                    //   Input (Cnst,Arr,Abs)              32
# 0x05, 0x01,                    //   Usage Page (Generic Desktop)      34
# 0x09, 0x30,                    //   Usage (X)                         36
# 0x09, 0x31,                    //   Usage (Y)                         38
# 0x16, 0x01, 0xf8,              //   Logical Minimum (-2047)           40
# 0x26, 0xff, 0x07,              //   Logical Maximum (2047)            43
# 0x75, 0x0c,                    //   Report Size (12)                  46
# 0x95, 0x02,                    //   Report Count (2)                  48
# 0x81, 0x06,                    //   Input (Data,Var,Rel)              50
# 0x09, 0x38,                    //   Usage (Wheel)                     52
# 0x15, 0x81,                    //   Logical Minimum (-127)            54
# 0x25, 0x7f,                    //   Logical Maximum (127)             56
# 0x75, 0x08,                    //   Report Size (8)                   58
# 0x95, 0x01,                    //   Report Count (1)                  60
# 0x81, 0x06,                    //   Input (Data,Var,Rel)              62
# 0x95, 0x01,                    //   Report Count (1)                  64
# 0x81, 0x03,                    //   Input (Cnst,Var,Abs)              66
# 0xc0,                          //  End Collection                     68
# 0xc0,                          // End Collection                      69
# 
R: 70 05 01 09 02 a1 01 85 02 09 01 a1 00 05 09 19 01 29 05 15 00 25 01 95 05 75 01 81 02 95 01 75 03 81 01 05 01 09 30 09 31 16 01 f8 26 ff 07 75 0c 95 02 81 06 09 38 15 81 25 7f 75 08 95 01 81 06 95 01 81 03 c0 c0
N: Flydigi Flydigi APEX 4
I: 3 04b4 2412
